{
  "$schema": "https://json-schema.org/draft/2020-12/schema",
  "title": "Project knowledge record v1",
  "type": "object",
  "additionalProperties": false,
  "required": [
    "schemaVersion",
    "id",
    "kind",
    "title",
    "conclusion",
    "limits",
    "created",
    "updated",
    "scope",
    "status",
    "attribution",
    "evidence",
    "related",
    "supersedes"
  ],
  "properties": {
    "schemaVersion": {
      "const": 1
    },
    "id": {
      "type": "string",
      "pattern": "^[a-z0-9][a-z0-9-]{0,127}$"
    },
    "kind": {
      "enum": [
        "architecture",
        "decision",
        "cause-fix",
        "experiment-positive",
        "experiment-negative",
        "qualification",
        "operating-lesson"
      ]
    },
    "title": {
      "type": "string",
      "minLength": 1
    },
    "conclusion": {
      "type": "string",
      "minLength": 1
    },
    "limits": {
      "type": "string",
      "minLength": 1
    },
    "created": {
      "type": "string",
      "format": "date"
    },
    "updated": {
      "type": "string",
      "format": "date"
    },
    "scope": {
      "type": "array",
      "uniqueItems": true,
      "items": {
        "type": "string",
        "minLength": 1
      }
    },
    "status": {
      "enum": [
        "observed",
        "accepted",
        "proposed",
        "open",
        "superseded"
      ]
    },
    "attribution": {
      "type": "array",
      "uniqueItems": true,
      "items": {
        "type": "string",
        "minLength": 1
      }
    },
    "evidence": {
      "type": "array",
      "minItems": 1,
      "items": {
        "type": "object",
        "additionalProperties": false,
        "required": [
          "repository",
          "revision",
          "path",
          "digest",
          "run",
          "url"
        ],
        "properties": {
          "repository": {
            "type": "string"
          },
          "revision": {
            "type": "string"
          },
          "path": {
            "type": "string"
          },
          "digest": {
            "type": "string"
          },
          "run": {
            "type": "string"
          },
          "url": {
            "type": "string"
          }
        }
      }
    },
    "related": {
      "type": "array",
      "uniqueItems": true,
      "items": {
        "type": "string",
        "minLength": 1
      }
    },
    "supersedes": {
      "type": "array",
      "uniqueItems": true,
      "items": {
        "type": "string",
        "minLength": 1
      }
    }
  }
}
